{
  "schemaVersion": "evidence-packet.v1",
  "candidateId": "exp100-tmdb-672647",
  "tmdbId": 672647,
  "sourceProvenance": [
    {
      "source": "tmdb-facts",
      "fields": [
        "title",
        "year",
        "director",
        "genres",
        "runtimeMinutes",
        "countries",
        "spokenLanguages"
      ],
      "version": "234b0ec724a2b9fd856a98192d81dc0f81fcca58f02b031b5846214d4bad18fc"
    },
    {
      "source": "tmdb-overview",
      "fields": [
        "overview"
      ],
      "version": "234b0ec724a2b9fd856a98192d81dc0f81fcca58f02b031b5846214d4bad18fc"
    }
  ],
  "facts": {
    "title": "The Map of Tiny Perfect Things",
    "year": 2021,
    "director": "Ian Samuels",
    "genres": [
      "Fantasy",
      "Romance"
    ],
    "runtimeMinutes": 99,
    "countries": [
      "United States of America"
    ],
    "spokenLanguages": [
      "English"
    ],
    "overview": "Two teenagers trapped in an endless time loop set out to find all the tiny things that make that one day perfect.",
    "keywords": []
  },
  "inputHash": "sha256:6fd30792ef1cc8d87514df3cbed092d2d589da48b68b8d4e982ab4a03de960fa"
}
